web-scraper-order,web-scraper-start-url,Reviews,Pagination,Pagination-href
"1530513013-360","https://www.indeed.co.in/cmp/Tata-Consultancy-Services-(tcs)/reviews","- Management is very Poor
-They don't consider about Employee's growth all they care is about their work
long work to work
no work/life balance.
extended hours of work
You will even need to come on Saturday for work
very hard to get vacation","49","https://www.indeed.co.in/cmp/Tata-Consultancy-Services-(tcs)/reviews?start=960"
"1530512529-205","https://www.indeed.co.in/cmp/Tata-Consultancy-Services-(tcs)/reviews","You will get a proper place and healthy environment to start your career. This company is good for freshers. The management hierarchy and culture is very important for an employee.","17","https://www.indeed.co.in/cmp/Tata-Consultancy-Services-(tcs)/reviews?start=320"
"1530512772-290","https://www.indeed.co.in/cmp/Tata-Consultancy-Services-(tcs)/reviews","Gave an good experience to it industry.Friendly employees and training given is excellent .Recuritment process is little tough except for that everything else was good","33","https://www.indeed.co.in/cmp/Tata-Consultancy-Services-(tcs)/reviews?start=640"
"1530512893-324","https://www.indeed.co.in/cmp/Tata-Consultancy-Services-(tcs)/reviews","Good for women associates for growing professionally and Personally.
Very good working atmosphere and fun at work.
We can enhance our skills by continuous learning through different learning platforms in TCS.","41","https://www.indeed.co.in/cmp/Tata-Consultancy-Services-(tcs)/reviews?start=800"
"1530513436-511","https://www.indeed.co.in/cmp/Tata-Consultancy-Services-(tcs)/reviews","Responsibilities are given to each individual based on their level to ensure smooth operations in business towards the customer and policies even circumstances are at worst.","77","https://www.indeed.co.in/cmp/Tata-Consultancy-Services-(tcs)/reviews?start=1520"
"1530512407-170","https://www.indeed.co.in/cmp/Tata-Consultancy-Services-(tcs)/reviews","As company it is very strong. But due to continous low hikes in last 3years employee satisfaction is at all time low. Job security and worklife balance are the key points of the company.","9","https://www.indeed.co.in/cmp/Tata-Consultancy-Services-(tcs)/reviews?start=160"
"1530512590-218","https://www.indeed.co.in/cmp/Tata-Consultancy-Services-(tcs)/reviews","You will have a wide range of projects to work on and the job security is very high. But the pay scale will be little less than standard as they will be providing more opportunities to travel abroad and they pay more for that. The management quality depends on the project you are in and the work life balance is not that great.","21","https://www.indeed.co.in/cmp/Tata-Consultancy-Services-(tcs)/reviews?start=400"
"1530512347-140","https://www.indeed.co.in/cmp/Tata-Consultancy-Services-(tcs)/reviews","I Have working in last 7 hours same concerned. I have experienced with Admin executive. And also maintain all activities in office ex. Security, housekeeping, water, DG, EB consumption, etc","5","https://www.indeed.co.in/cmp/Tata-Consultancy-Services-(tcs)/reviews?start=80"
"1530513618-575","https://www.indeed.co.in/cmp/Tata-Consultancy-Services-(tcs)/reviews","Legacy tools are used in some of the project.Internal hikes are very less.Some projects do hav einternal politics which sopil the culture of the organisation.","89","https://www.indeed.co.in/cmp/Tata-Consultancy-Services-(tcs)/reviews?start=1760"
"1530513678-609","https://www.indeed.co.in/cmp/Tata-Consultancy-Services-(tcs)/reviews","I believe it's the best company to work as we are given the liberty of flexibility and a fun to work environment.

One will encounter with many people coming from a variety of education background and experiences from various different industry sectors.

One will create their own work family in TCS.

Management is very helpful and generous .

The work culture is pretty awesome as in TCS there are many events that increases connection amongst other team members.","93","https://www.indeed.co.in/cmp/Tata-Consultancy-Services-(tcs)/reviews?start=1840"
"1530512953-347","https://www.indeed.co.in/cmp/Tata-Consultancy-Services-(tcs)/reviews","Most Managers in the Project had little or no technical background so it was very difficult to make them realize the timeline for a project delivery was insufficient.","45","https://www.indeed.co.in/cmp/Tata-Consultancy-Services-(tcs)/reviews?start=880"
"1530513557-566","https://www.indeed.co.in/cmp/Tata-Consultancy-Services-(tcs)/reviews","Good company to work. Good learning opportunities. You get to work on latest technologies to work. Good management. Good work culture. Good job security.","85","https://www.indeed.co.in/cmp/Tata-Consultancy-Services-(tcs)/reviews?start=1680"
"1530513618-583","https://www.indeed.co.in/cmp/Tata-Consultancy-Services-(tcs)/reviews","TCS has a flexible work environment. Great learning provided. TCS is there across location in India and outstation. Provides great work value. But Salary structure is very low.","89","https://www.indeed.co.in/cmp/Tata-Consultancy-Services-(tcs)/reviews?start=1760"
"1530513497-532","https://www.indeed.co.in/cmp/Tata-Consultancy-Services-(tcs)/reviews","Nice to be part of TCS...Greatest experience of my life....good work culture and employee friendly organization....there is always job security and no need to be worried about..","81","https://www.indeed.co.in/cmp/Tata-Consultancy-Services-(tcs)/reviews?start=1600"
"1530513134-416","https://www.indeed.co.in/cmp/Tata-Consultancy-Services-(tcs)/reviews","Tata Consultancy Services (TCS ) is best place to work for apart from some small negative culture in some of the process. Good job security.  Slow growth","57","https://www.indeed.co.in/cmp/Tata-Consultancy-Services-(tcs)/reviews?start=1120"
"1530512651-239","https://www.indeed.co.in/cmp/Tata-Consultancy-Services-(tcs)/reviews","Working with TCS was really a wide range of learning and an excellent experience of workplace culture.
Have started my career as a developer , growing it further as the technical lead. Later taking uo new opportunities to expand my learning and growth as a business and project manager. 
Extensively worked in the Life sciences domain within these years.
TCS , I could see as a provider to explore & excel your abilities.
 An approachable management who will value the smallest input  from any team member and will give equal opportunities to grow.","25","https://www.indeed.co.in/cmp/Tata-Consultancy-Services-(tcs)/reviews?start=480"
"1530513557-564","https://www.indeed.co.in/cmp/Tata-Consultancy-Services-(tcs)/reviews","It is fun working for TCS. But, work life balance is an area where the organization needs to work upon.
I got to learn many a things while working for the organization specially the management,leadership and analytical skills.","85","https://www.indeed.co.in/cmp/Tata-Consultancy-Services-(tcs)/reviews?start=1680"
"1530513195-437","https://www.indeed.co.in/cmp/Tata-Consultancy-Services-(tcs)/reviews","Manage and execute highly level corporate initiatives with the goal to increase operational efficiencies and/or mitigate risk.
US Mortgage – Origination underwriting End to End process.","61","https://www.indeed.co.in/cmp/Tata-Consultancy-Services-(tcs)/reviews?start=1200"
"1530512407-156","https://www.indeed.co.in/cmp/Tata-Consultancy-Services-(tcs)/reviews","This is a good organisation to work with and has good policies which are employee friendly and allow the employee feel comfortable. The management is good and communication is open.","9","https://www.indeed.co.in/cmp/Tata-Consultancy-Services-(tcs)/reviews?start=160"
"1530512281-110","https://www.indeed.co.in/cmp/Tata-Consultancy-Services-(tcs)/reviews","Had a good time as a developer in TCS. Work culture is nice, people are very friendly and helpful. We can learn almost all the technologies being a part of TCS.","",""
"1530512832-311","https://www.indeed.co.in/cmp/Tata-Consultancy-Services-(tcs)/reviews","The job is very demanding, but that makes it a good place to start learning when new in the industry. It has taught both the non-technical parts of a project starting from project management to technicalities like ETL, Data Warehousing etc.","37","https://www.indeed.co.in/cmp/Tata-Consultancy-Services-(tcs)/reviews?start=720"
"1530513436-517","https://www.indeed.co.in/cmp/Tata-Consultancy-Services-(tcs)/reviews","Tata Consultancy Services is a good company as it has transparent & Employee friendly HR Policies.
There are Ocean of opportunities in the company & one can take advantage of the same.","77","https://www.indeed.co.in/cmp/Tata-Consultancy-Services-(tcs)/reviews?start=1520"
"1530512281-121","https://www.indeed.co.in/cmp/Tata-Consultancy-Services-(tcs)/reviews","Good work/life balance.Management was encouraging and supportive.Good place to begin your career.Fewer opportunities to employees for career advancement","",""
"1530512953-349","https://www.indeed.co.in/cmp/Tata-Consultancy-Services-(tcs)/reviews","Tcs had given me opportunities to start my career in Computer Field as Computer Engineer. So I always thankful for that start. I did not want to leave But because of Higher studies, i had to take that step.","45","https://www.indeed.co.in/cmp/Tata-Consultancy-Services-(tcs)/reviews?start=880"
"1530513315-465","https://www.indeed.co.in/cmp/Tata-Consultancy-Services-(tcs)/reviews","- Management is very Poor
-They don't consider about Employee's growth all they care is about their work
long work to work
no work/life balance.
extended hours of work
You will even need to come on Saturday for work
very hard to get vacation","69","https://www.indeed.co.in/cmp/Tata-Consultancy-Services-(tcs)/reviews?start=1360"
"1530513557-561","https://www.indeed.co.in/cmp/Tata-Consultancy-Services-(tcs)/reviews","A friendly atmosphere at the workplace.  Management is friendly and equipped with proper knowledge of work. Fitness and fun is given equal weightage at the workplace.","85","https://www.indeed.co.in/cmp/Tata-Consultancy-Services-(tcs)/reviews?start=1680"
"1530512347-131","https://www.indeed.co.in/cmp/Tata-Consultancy-Services-(tcs)/reviews","Very Flexible work timings , good guidance from the senior level .
A very conducive atmosphere to learn and grow .
Transparent appraisals will let you understand and grow more .","5","https://www.indeed.co.in/cmp/Tata-Consultancy-Services-(tcs)/reviews?start=80"
"1530513678-602","https://www.indeed.co.in/cmp/Tata-Consultancy-Services-(tcs)/reviews","Goods review in company and good work this companies telant work and saf job yor company and your company management is best and your company     work is most intaligent with person","93","https://www.indeed.co.in/cmp/Tata-Consultancy-Services-(tcs)/reviews?start=1840"
"1530512772-285","https://www.indeed.co.in/cmp/Tata-Consultancy-Services-(tcs)/reviews","Had a good learning experience professionally. Got to learn managerial skills from my supervisor. Employee is respected. Overall a good place to work with.","33","https://www.indeed.co.in/cmp/Tata-Consultancy-Services-(tcs)/reviews?start=640"
"1530513074-395","https://www.indeed.co.in/cmp/Tata-Consultancy-Services-(tcs)/reviews","Company has provided lots of benefits to the employees.. These benefits will only available for those employees who is working in TCS.. At the same time there is some job security for the employees..","53","https://www.indeed.co.in/cmp/Tata-Consultancy-Services-(tcs)/reviews?start=1040"
"1530513074-382","https://www.indeed.co.in/cmp/Tata-Consultancy-Services-(tcs)/reviews","I have work in the environment where every minute was count so I have work experience in pressure, I am very flexible in manner of work. I am good learner, team member","53","https://www.indeed.co.in/cmp/Tata-Consultancy-Services-(tcs)/reviews?start=1040"
"1530512893-335","https://www.indeed.co.in/cmp/Tata-Consultancy-Services-(tcs)/reviews","As per my role, It is a good place to learn and do R&D on new technologies. apart from work, I got an opportunity to improve managerial and communication skills","41","https://www.indeed.co.in/cmp/Tata-Consultancy-Services-(tcs)/reviews?start=800"
"1530512529-196","https://www.indeed.co.in/cmp/Tata-Consultancy-Services-(tcs)/reviews","Training & Process Specialist, with multi-domain expertise in driving strategic Learning & Development initiatives to realize bottom-line results and enhance employee development enabling them to fulfill their potential within the organization","17","https://www.indeed.co.in/cmp/Tata-Consultancy-Services-(tcs)/reviews?start=320"
"1530512893-323","https://www.indeed.co.in/cmp/Tata-Consultancy-Services-(tcs)/reviews","Good place to work. Plenty of opportunities to learn and improve overall. In terms of salary, the average salary is way below the global standard irrespective of work location.","41","https://www.indeed.co.in/cmp/Tata-Consultancy-Services-(tcs)/reviews?start=800"
"1530513376-494","https://www.indeed.co.in/cmp/Tata-Consultancy-Services-(tcs)/reviews","learned a lot of things.
workplace was very professional.
The most enjoyable part was i made many friends use to learnt a lot from them.
Hardest part to learning language sometimes which i tried to learn a lot.","73","https://www.indeed.co.in/cmp/Tata-Consultancy-Services-(tcs)/reviews?start=1440"
"1530513195-433","https://www.indeed.co.in/cmp/Tata-Consultancy-Services-(tcs)/reviews","A very good company to work with. Ample opportunities and diverse culture.Great leadership and good training. Numerous projects and flexible timings and flexible work location.","61","https://www.indeed.co.in/cmp/Tata-Consultancy-Services-(tcs)/reviews?start=1200"
"1530512711-262","https://www.indeed.co.in/cmp/Tata-Consultancy-Services-(tcs)/reviews","-9 hours work with 1 hour leisure time
-Technical and professional knowledge
-Good management policies implemented.
-Disciplined workplace culture
-Team Outings are the most enjoyable part of the job","29","https://www.indeed.co.in/cmp/Tata-Consultancy-Services-(tcs)/reviews?start=560"
"1530512651-238","https://www.indeed.co.in/cmp/Tata-Consultancy-Services-(tcs)/reviews","I liked being a part of the organization where I started my career. Being able to adapt myself to the changing work environment. Taught me how to approach various situations and how to get over with it.","25","https://www.indeed.co.in/cmp/Tata-Consultancy-Services-(tcs)/reviews?start=480"
"1530513315-466","https://www.indeed.co.in/cmp/Tata-Consultancy-Services-(tcs)/reviews","It is an good place to work and i gained lot of information and it is the safest place for the women's, in Tcs they will conduct Olympia to develope our talents","69","https://www.indeed.co.in/cmp/Tata-Consultancy-Services-(tcs)/reviews?start=1360"
"1530513497-530","https://www.indeed.co.in/cmp/Tata-Consultancy-Services-(tcs)/reviews","Have learned a lot of things from my Manager and Management. Different shift timings. Job Security, Nice Place and people. Good Transport Facility. Fun Fridays","81","https://www.indeed.co.in/cmp/Tata-Consultancy-Services-(tcs)/reviews?start=1600"
"1530513557-569","https://www.indeed.co.in/cmp/Tata-Consultancy-Services-(tcs)/reviews","I worked for TCS since a year make a memorable moment for me as it was my first job. 
The work environment was excellent and one thing is very important that it doesn't fire the associate in any condition till it is tolerable.","85","https://www.indeed.co.in/cmp/Tata-Consultancy-Services-(tcs)/reviews?start=1680"
"1530512281-117","https://www.indeed.co.in/cmp/Tata-Consultancy-Services-(tcs)/reviews","Nice company and have very good approach in the technology. Gives good training to the employer to get better performance. Nice work Environment which help in the working task.","",""
"1530512590-230","https://www.indeed.co.in/cmp/Tata-Consultancy-Services-(tcs)/reviews","poor management
change of project not possible easily
appraisal system is an eye wash
have good training resources
management doesnt even discuss with you for your appraisal","21","https://www.indeed.co.in/cmp/Tata-Consultancy-Services-(tcs)/reviews?start=400"
"1530512772-293","https://www.indeed.co.in/cmp/Tata-Consultancy-Services-(tcs)/reviews","A very good company to start your career with if you are starting with a good project in a good role. Or else you have to strive hard and need to switch asap.","33","https://www.indeed.co.in/cmp/Tata-Consultancy-Services-(tcs)/reviews?start=640"
"1530512711-274","https://www.indeed.co.in/cmp/Tata-Consultancy-Services-(tcs)/reviews","Enjoyed working there. Learnt lot of things regarding the work. It has very good environment. I am thankful to this organization for providing me to show up my knowledge and enhance my skills.","29","https://www.indeed.co.in/cmp/Tata-Consultancy-Services-(tcs)/reviews?start=560"
"1530513436-509","https://www.indeed.co.in/cmp/Tata-Consultancy-Services-(tcs)/reviews","This is my favourite company to work with. Tata management has maintained the work ethics. One can keep on working in this organization for a longer duration.","77","https://www.indeed.co.in/cmp/Tata-Consultancy-Services-(tcs)/reviews?start=1520"
"1530513557-554","https://www.indeed.co.in/cmp/Tata-Consultancy-Services-(tcs)/reviews","It has a great working environment. Possibly good for those who are looking for work life balance. But there are lack of opportunities and growth there which is kind of a drawback.","85","https://www.indeed.co.in/cmp/Tata-Consultancy-Services-(tcs)/reviews?start=1680"
"1530512772-276","https://www.indeed.co.in/cmp/Tata-Consultancy-Services-(tcs)/reviews","- Management is very Poor
-They don't consider about Employee's growth all they care is about their work
long work to work
no work/life balance.
extended hours of work
You will even need to come on Saturday for work
very hard to get vacation","33","https://www.indeed.co.in/cmp/Tata-Consultancy-Services-(tcs)/reviews?start=640"
"1530512772-283","https://www.indeed.co.in/cmp/Tata-Consultancy-Services-(tcs)/reviews","the environment was good. Interactive Sessions. Lots to learn and explore there regarding different Technology. lots of evening and night shifts were there.","33","https://www.indeed.co.in/cmp/Tata-Consultancy-Services-(tcs)/reviews?start=640"
"1530513074-388","https://www.indeed.co.in/cmp/Tata-Consultancy-Services-(tcs)/reviews","Very gud management and gud rapid with the HRs so that we can solve our personal issues well. 
Encourages new talents..I myself joined as a trainee and had gud recognition for my works","53","https://www.indeed.co.in/cmp/Tata-Consultancy-Services-(tcs)/reviews?start=1040"
"1530513074-399","https://www.indeed.co.in/cmp/Tata-Consultancy-Services-(tcs)/reviews","Tata Consultancy Services was a great platform for me to learn about the trending technologies and professional ethics.
It was fun to work with them.
They have really good mentors to groom each associate and friendly HR.","53","https://www.indeed.co.in/cmp/Tata-Consultancy-Services-(tcs)/reviews?start=1040"
"1530512893-337","https://www.indeed.co.in/cmp/Tata-Consultancy-Services-(tcs)/reviews","I have been in TCS for 2+ years and it has been great journey so far.
The company provides you numerous platforms to grow not only in technical grounds but personal levels as well. The teams work in collaboration for their deliverable, CSR activities as well as team level activities like team outings, team lunches etc. I have learned a lot of things again including technical and non-technical aspects. I enjoyed working in the team where everyone was supportive and helpful.","41","https://www.indeed.co.in/cmp/Tata-Consultancy-Services-(tcs)/reviews?start=800"
"1530513376-496","https://www.indeed.co.in/cmp/Tata-Consultancy-Services-(tcs)/reviews","Its better to be jobless than getting into such company. you work sincerely for entire year and you get only 500 increment in your monthly pay. If due to some unforeseen reason you resign you cannot get back. Senior managers and management will not support you if client is wrong, in fact they will ask you to apologies. Growth and promotion to only favorites and does not require hard work. will never understand your personal issues. no work & life balance.","73","https://www.indeed.co.in/cmp/Tata-Consultancy-Services-(tcs)/reviews?start=1440"
"1530513195-425","https://www.indeed.co.in/cmp/Tata-Consultancy-Services-(tcs)/reviews","Good company to work. I quit since i wanted to relocate to a different place. Pay compensation is competitive. Good onsite opportunities and career growth","61","https://www.indeed.co.in/cmp/Tata-Consultancy-Services-(tcs)/reviews?start=1200"
"1530513315-470","https://www.indeed.co.in/cmp/Tata-Consultancy-Services-(tcs)/reviews","TCS is best platform to learn and start your career. It has projects in many dimensions and multiple technologies. Has practices in many domains and countries around the world.","69","https://www.indeed.co.in/cmp/Tata-Consultancy-Services-(tcs)/reviews?start=1360"
"1530512347-145","https://www.indeed.co.in/cmp/Tata-Consultancy-Services-(tcs)/reviews","The work culture at Tata Consultancy Services is good.
I learned lot of experience here.Both technically and personal to my life.
I'm happy to work with my co-workers","5","https://www.indeed.co.in/cmp/Tata-Consultancy-Services-(tcs)/reviews?start=80"
"1530512832-302","https://www.indeed.co.in/cmp/Tata-Consultancy-Services-(tcs)/reviews","This place has got a very large number of employees and various domains which makes it flexible to work and enhance your career. There is lot of interaction with various people which is always good to build your skill set.","37","https://www.indeed.co.in/cmp/Tata-Consultancy-Services-(tcs)/reviews?start=720"
"1530512590-214","https://www.indeed.co.in/cmp/Tata-Consultancy-Services-(tcs)/reviews","very employee friendly
 work environment is amazing
 learnt to manage and tackle different challenging situations everyday 
learnt the corporate culture which is very enjoyable","21","https://www.indeed.co.in/cmp/Tata-Consultancy-Services-(tcs)/reviews?start=400"
"1530513497-541","https://www.indeed.co.in/cmp/Tata-Consultancy-Services-(tcs)/reviews","Everything about the company is good from my point of view and yeah it depends on the individual how you take it on.
It's all about how your hierarchy is.","81","https://www.indeed.co.in/cmp/Tata-Consultancy-Services-(tcs)/reviews?start=1600"
"1530512469-180","https://www.indeed.co.in/cmp/Tata-Consultancy-Services-(tcs)/reviews","I have been working at Tata Consultancy Services full-time (More than two years.

Good Onsite opportunities for Visa holders.Good to join if you are preparing for higher study or other exams.","13","https://www.indeed.co.in/cmp/Tata-Consultancy-Services-(tcs)/reviews?start=240"
"1530512953-346","https://www.indeed.co.in/cmp/Tata-Consultancy-Services-(tcs)/reviews","I have been working there for 3.5 years and mostly I've experienced a decent career growth. The people around you are usually good and very friendly

However there have been times (happens often) when you are made to work way more than you are paid for. In fact, you don't get paid for overtime. Even if you are entitled to 16 paid leaves a year, you would end up utilizing only about 5-6 since you would not get the permission for utilizing the others from the management.

All exciting opportunities are based on resource requirements, internal politics and at no point based on your performance whatsoever. At times, you get a feeling that you are just one among 4 hundred thousand helpless souls. There are a few good managers. However, most of them are incompetent who only care about profits and their own safety.","45","https://www.indeed.co.in/cmp/Tata-Consultancy-Services-(tcs)/reviews?start=880"
"1530512347-149","https://www.indeed.co.in/cmp/Tata-Consultancy-Services-(tcs)/reviews","100% Secured job, plenty of opportunities. Can improve your professional growth if you are in good hands.No worries if you are in bench, improve your skill from the learning tools available in TCS.","5","https://www.indeed.co.in/cmp/Tata-Consultancy-Services-(tcs)/reviews?start=80"
"1530512711-257","https://www.indeed.co.in/cmp/Tata-Consultancy-Services-(tcs)/reviews","It is good company for higher level of your career. And for people who get onsite opportunities. Campus is good with all co curricular activities around.","29","https://www.indeed.co.in/cmp/Tata-Consultancy-Services-(tcs)/reviews?start=560"
"1530513134-402","https://www.indeed.co.in/cmp/Tata-Consultancy-Services-(tcs)/reviews","- Management is very Poor
-They don't consider about Employee's growth all they care is about their work
long work to work
no work/life balance.
extended hours of work
You will even need to come on Saturday for work
very hard to get vacation","57","https://www.indeed.co.in/cmp/Tata-Consultancy-Services-(tcs)/reviews?start=1120"
"1530513195-441","https://www.indeed.co.in/cmp/Tata-Consultancy-Services-(tcs)/reviews","productive and active participation in all activities. more learning. Good Salary.
A good start up for the freshers and experienced employees could shape their career.","61","https://www.indeed.co.in/cmp/Tata-Consultancy-Services-(tcs)/reviews?start=1200"
"1530512651-254","https://www.indeed.co.in/cmp/Tata-Consultancy-Services-(tcs)/reviews","It was nice to work with TCS.The best thing about company is that they take proper care of their employees specially female employee and also drop to home was being provided.","25","https://www.indeed.co.in/cmp/Tata-Consultancy-Services-(tcs)/reviews?start=480"
